legal_aid_service_area,total_filed,total_default,total_judgment,total_plaintiff_won,total_immediate,median_principal,n_d_attorney,cases_plaintiff_business
Blue Ridge Legal Services,21586,6976,10937,10774,2731,1550,592,13600
Central Virginia Legal Aid Society,184712,73125,100907,100332,59438,1273.025,1030,159321
Legal Aid Society of Eastern Virginia,251564,101626,135602,135426,108986,1255,1554,210920
Legal Aid Society of Roanoke Valley,23551,8233,12964,12812,4968,1485,568,17092
Legal Aid Works,24726,7739,12619,12496,5178,2156.12,363,18161
Legal Services of Northern Virginia,94620,30022,40580,40743,26840,3300,1225,83196
Southwest Virginia Legal Aid Society,18696,6686,11227,11026,2466,1091,306,10799
Virginia Legal Aid Society,47583,17307,26471,26072,10429,1123,529,29836
